idcvlac,nombre,fecha
0001344816,"Mención de honor: IX Encuentro infantil de teatro,FUNDACION REAL COLEGIO SAN FRANCISCO DE ASIS",2007
0001344816,"Premio EXALTARTE,secretaria de educación de popayán",2013
0001344816,"Ganadora de Convocatoria 07-2015. Semilleros de Investigación. Innovacción Cauca. Popayán 2015.,UNIVERSIDAD DEL CAUCA",2015
0001344816,"Al desempeño en el desarrollo de las actividades de Ciencia, Tecnología e Innovación durante el año 2016,CORPORACIÓN UNIVERSITARIA AUTÓNOMA DEL CAUCA",2016
0001707086,"Estímulo Académico ,UNIVERSIDAD DEL CAUCA",2019
0001450269,"Mención Honorífica,UNIVERSIDAD DE CALDAS",2020
0001450269,"Mención de Honor,UNIVERSIDAD DEL CAUCA",2021
0001450269,"Mención de honor tesis doctorado ,UNIVERSIDAD DEL CAUCA",2022
0000088566,"Trabajo Honorífico,UNIVERSIDAD DEL CAUCA",2019
0000113858,"PROYECTO SOBRESALIENTE,Fundacion Red Colombiana de Semilleros de Investigacion - RedColsi Nodo Barranquilla",2017
0000666572,"Reconocimiento Universitario,UNIVERSIDAD DEL CAUCA",2009
0000666572,"Homenaje de Reconocimiento,UNIVERSIDAD COOPERATIVA DE COLOMBIA",2010
0000666572,"Mejor comunicación ""Efectos de la divulgación de rankings universitarios y su relación con los índices de eficiencia: análisis bibliométrico"",Universidad de Valencia",2016
0000666572,"Reconocimiento de labor en Comitè de Plan Bicentenario,UNIVERSIDAD DEL CAUCA",2015
0000666572,"Reconocimiento a la Labor Investigativa,UNIVERSIDAD DEL QUINDÍO",2021
0000666572,"Reconocimiento Avances en investigación GREIFG,UNIVERSIDAD DEL CAUCA",2019
0000666572,"Trayectoria Investigativa, calidad de producción y Excelencia Científica. Investigadora Junior ,UNIVERSIDAD DEL CAUCA",2019
0000130468,"Al COMPROMISO INSTITUCIONAL EN EL FORTALECIMIENTO DE LA LABOR ACADÉMICA EN CONTADURÍA PUBLICA,FUNDACION UNIVERSITARIA DE POPAYAN",2017
0000130468,"PREMIOS A LA INNOCACIÓN UNIVERSITARIA 2021,Corporación para la Integración y desarrollo de la educación en el suroccidente colombiano",2021
0000601764,"DEDICACION INCONDICIONAL A LOS ESTUDIANTES,UNIVERSIDAD ANTONIO NARIÑO",2003
0000601764,"Premio profesor autor,UNIVERSIDAD AUTONOMA DE OCCIDENTE",2009
0000601764,"Reconocimiento Estímulo Económico Producción Intelectual de Alto Impacto,UNIVERSIDAD AUTONOMA DE OCCIDENTE",2018
0000402109,"Distincion mejor Docente Facultad de Contaduria Publica,UNIVERSIDAD COOPERATIVA DE COLOMBIA",2003
0000402109,"RECONOCIMIENTO POR OBTENCIÓN DE ACREDITACION DE ALTA CALIDAD AL PROGRAMA DE CONTADURIA UNIVERSIDAD DEL CAUCA,UNIVERSIDAD DEL CAUCA",2018
0000402109,"RECONOCIMIENTO COMO JEFE DEPARTAMENTO CIENCIAS CONTABLES UNIVERSIDAD DEL CAUCA,UNIVERSIDAD DEL CAUCA",2019
0000402109,"mención de honor por clasificación del grupo VINCO en Categoría D de Colciencias,UNIVERSIDAD COOPERATIVA DE COLOMBIA",2008
0001405221,"Medalla al Mérito Educativo de Educador Distinguido,Confederacion Nacional Catolica de Educación CONACED",2011
0001405221,"Medalla al Mérito Educativo de Educador Distinguido,Confederacion Nacional Catolica de Educación CONACED",2014
0001405221,"Reconocimiento por compromiso institucional en el fortalecimiento de labor académica Fundación Universitaria de Popayán,FUNDACION UNIVERSITARIA DE POPAYAN",2017
0001405221,"Reconocimiento por apoyo, participación y compromiso en los procesos de autoevaluación institucional. Fundación Universitaria de Popayán,FUNDACION UNIVERSITARIA DE POPAYAN",2017
0001405221,"Reconocimiento por desempeño institucional en el concurso Bolsa Millonaria de la Bolsa de Valores de Colombia,FUNDACION UNIVERSITARIA DE POPAYAN",2017
0001405221,"Reconocimiento por apoyo, participación y compromiso con la investigación en el programa de Contaduría Pública. Fundación Universitaria de Popayán,FUNDACION UNIVERSITARIA DE POPAYAN",2017
0001405221,"Reconocimiento por trayectoria y 5 años de servicio como docente del programa de Contaduría Pública de la Fundación Universitaria de Popayán,FUNDACION UNIVERSITARIA DE POPAYAN",2017
0001338092,"Mención Honorifica,UNIVERSIDAD DEL CAUCA",2020
0000002411,"AfroColombiana del año 2021 Categoría Académia,Fundación Color de Colombia",2021
0000434493,"Grado de Honor,UNIVERSIDAD DE SUCRE",1998
0000857718,"mención de honor,UNIVERSIDAD DEL CAUCA",2005
0001631943,"Tesis Laureada,UNIVERSIDAD DEL CAUCA",2017
0001631943,"Matrícula de Honor ,UNIVERSIDAD DEL CAUCA",2009
0001631943,"Matrícula de Honor ,UNIVERSIDAD DEL CAUCA",2010
0001631943,"Matrícula de Honor ,UNIVERSIDAD DEL CAUCA",2010
0001631943,"Media Matrícula de Honor ,UNIVERSIDAD DEL CAUCA",2011
0001631943,"Matrícula de Honor ,UNIVERSIDAD DEL CAUCA",2013
0000558737,"Tesis de doctorado Laureada,UNIVERSIDAD DEL VALLE",2020
0001393216,"Mejor Trabajo Docente,Universidad de la Sierra Sur",2006
0001393216,"Mención Honorífica tesis de Maestría,UNIVERSIDAD NACIONAL AUTÓNOMA DE MÉXICO",2004
0001393216,"Mención Honorífica tesis de Doctorado,UNIVERSIDAD NACIONAL AUTÓNOMA DE MÉXICO",2009
0001393216,"Mejor Trabajo de Investigación,Universidad de la Sierra Sur",2007
0001393216,"Beca para investigación Posdoctoral,Universidad Autónoma Metropolitana",2011
0001393216,"Reconocimiento Académico a Mejor Labor Docente e Investigativa,Universidad de la Sierra Sur",2007
0001393216,"Beca para estudio de Postgrado (Doctorado),UNIVERSIDAD NACIONAL AUTÓNOMA DE MÉXICO",2004
0001393216,"Beca para Estudio de Postgrado (Maestría),UNIVERSIDAD NACIONAL AUTÓNOMA DE MÉXICO",2001
0001393216,"Reconocimiento Mejor Trabajo de Investigación,UNIVERSIDAD NACIONAL AUTÓNOMA DE MÉXICO",2001
0001393216,"Reconocimiento Mejor Labor Docente,Instituto Alexander Dul",2001
0000063173,Becas Iberoamérica. Estudiantes de grado. Santander universidades,2016
0000333093,"Beca Tipo I,Agencia Nacional de Promoción Científica y Tecnológica",2009
0000333093,"Beca Tipo II,Conicet",2013
0000547972,"Matrícula de Honor - pregrado,UNIVERSIDAD DEL CAUCA",1998
0000547972,"Matrícula de Honor - pregrado,UNIVERSIDAD DEL CAUCA",1999
0000547972,"Media Matrícula de Honor - pregrado,UNIVERSIDAD DEL CAUCA",2000
0000547972,"Matrícula de Honor - pregrado,UNIVERSIDAD DEL CAUCA",2000
0000547972,"Matrícula de Honor - pregrado,UNIVERSIDAD DEL CAUCA",2001
0000547972,"VIII Convocatoria a Becas para elaboración de Tesis de Maestría, FLACSO Ecuador,Facultad Latinoamericana de Ciencias Sociales (FLACSO) Ecuador",2007
0000547972,"Beca MAE-AECID para la realización de estudios de posgrado en España, 2010.,Becas MAE-AECID",2010
0000547972,"Beca Colciencias, Convocatoria 617 de 2013, doctorados en el exterior,Ministerio de Ciencia, Tecnología e Innovación",2013
0000547972,"MENCIÓN HONORÍFICA,UNIVERSIDAD DEL CAUCA",2021
0000547972,"Ganador Convocatoria 001-2019 Apoyo a Emprendimientos Innovadores de Base Tecnológica de la Universidad del Cauca,UNIVERSIDAD DEL CAUCA",2019
0000341673,"Tesis meritoria,UNIVERSIDAD DEL CAUCA",2010
0000499668,"Beca de residencia,Instituto Internacional de Sociología Jurídica de Oñati",2007
0000499668,"Beca Doctorado,UNIVERSIDAD SANTIAGO DE CALI",2003
0000542687,"Beca de Honor,UNIVERSIDAD DEL CAUCA",2003
0000542687,"Beca de Honor,UNIVERSIDAD DEL CAUCA",2004
0000542687,"Excelencia al desempeño docente,UNIVERSIDAD DEL VALLE",2017
0000542687,"Excelencia al desempeño docente,UNIVERSIDAD DEL VALLE",2018
0000524204,"Beca de manutención maestría en gobierno de la ciudad, con mención en centralidad urbana y áreas históricas,Facultad Latinoamericana De Ciencias Sociales",2006
0000524204,"Beca de colegiatura maestría en gobierno de la ciudad, con mención en centralidad urbana y áreas históricas,Facultad Latinoamericana De Ciencias Sociales",2006
0000524204,"Mención de honor tesis de pregrado en ciencia política: ""del poder y la religión, estudio de la mentalidad cristiano feudal en Popayán, una historia de larga duración"",UNIVERSIDAD DEL CAUCA",2006
0000524204,"Matricula de Honor Programa de Antropología,UNIVERSIDAD DEL CAUCA",1997
0000524204,"Matricula de Honor Programa de Antropología,UNIVERSIDAD DEL CAUCA",1996
0000524204,"Matricula de Honor Programa de Antropología,UNIVERSIDAD DEL CAUCA",1995
0000524204,"Matricula de Honor Programa de Antropología,UNIVERSIDAD DEL CAUCA",1994
0000524204,"Beca para la realización de tesis de maestría: ""Entre ángeles y guerreros, Popayán 1880-1930"",Facultad Latinoamericana De Ciencias Sociales",2008
0000063130,"Media matricula de honor,UNIVERSIDAD DEL CAUCA",2017
0000063130,"Movilidad Académica en la Universidad Nacional Autónoma de México - UNAM,UNIVERSIDAD NACIONAL AUTÓNOMA DE MÉXICO",2018
0000063130,"Subvención por costos de matricula para movilidad académica en la Universidad Nacional Autónoma de México - UNAM ,UNIVERSIDAD DEL CAUCA",2018
0000063130,"Matricula de honor ,UNIVERSIDAD DEL CAUCA",2019
0000063130,"Matricula de honor ,UNIVERSIDAD DEL CAUCA",2019
0001442959,"Tesis meritoria ,UNIVERSIDAD EXTERNADO DE COLOMBIA",2017
0000156412,"Medalla al Mérito Académico a nivel DOCTORADO (UAM X) ,Universidad Autónoma Metropolitana Unidad Xochimilco",2017
0000156412,"Mención Honorifica (Promedio:9.92) por obtención de grado de maestría con altas calificaciones en la Maestría de Estudios Latinoaméricanos de la Universidad Nacional Autónoma de México (UNAM),UNIVERSIDAD NACIONAL AUTÓNOMA DE MÉXICO",2012
0000156412,"Mención Honorífica (Promedio:9.42). por obtención de grado con altas calificaciones en la licenciatura de Ciencias Políticas y Adminsitración Pública cursada en la Facultad de Ciencias Políticas y Sociales de la Universidad Nacional Autónoma de México (FC,UNIVERSIDAD NACIONAL AUTÓNOMA DE MÉXICO",2008
0000156412,"Reconocimiento por impartir conferencia: ¿Luchas sociales en el contexto político actual? ,BRUJULA METROPOLITANA",2018
0000156412,"INTEGRANTE DEL SISTEMA NACIONAL DE INVESTIGADORES DE MÉXICO CON LA DISTINCIÓN DEL NIVEL: CANDIDATO A INVESTIGADOR,Consejo Nacional De Ciencia Y Tecnología (Conacyt - México)",2018
0000156412,"INTEGRANTE DE LA ASOCIACIÓN COLOMBIANA DE CIENCIA POLÍTICA ACCPOL,UNIVERSIDAD DEL CAUCA",2019
0000156412,"Libro ganador de convocatoria de investigación de la Universidad del Cauca 2018,UNIVERSIDAD DEL CAUCA",2019
0000156412,"Integrante del proyecto de publicación ganador en la convocatoria: «Miradas Latinoamericanas. Un estado del debate,CLACSO",2020
0000156412,"Beca CONACYT-Maestría ,Sistema Nacional de Investigadores del Conacyt",2009
0000156412,"Beca CONACYT-Doctorado,Sistema Nacional de Investigadores del Conacyt",2013
0000156412,"Miembro del Consejo de Evaluadores de la Revista de Sociología de la  Universidad Central de Chile ,Universidad Central de Chile",2020
0000156412,"Sistema Nacional de Investigadores Nivel 1 CONACYT, México",2022
0000525278,"Apoyo en Pro de la investigación por el más alto nivel académico en Doctorado en Humanidades y en la Línea Historias, sociedades y culturas afrolatinoamericanas Docencia 2013 - 2014,UNIVERSIDAD DEL VALLE",2014
0000525278,"Miembro de número de la Asociación Iberoamericana de Filosofía práctica ,UNIVERSIDAD AUTONOMA DEL ESTADO DE MORELOS",2017
0000525278,"RECONOCIMIENTO AL APOYO Y LA LABOR DOCENTE,Asociación Iberoamericana de Filosofía Práctica",2014
0000525278,"RECONOCIMIENTO DE PARTICIPACIÓN,UNIVERSIDAD DEL VALLE",2017
0000525278,"RECONOCIMIENTO DÍA DE LA AFROCOLOMBIANIDAD,CORPORACIÓN  UNIVERSITARIA COMFACAUCA - UNICOMFACAUCA",2015
0000525278,"RECONOCIMIENTO DE PARTICIPACIÓN,UNIVERSIDAD DEL CAUCA",2013
0000525278,"RECONOCIMIENTO DE PARTICIPACIÓN EN LA ASOCIACIÓN IBEROAMERICANA DE FILOSOFÍA PRÁCTICA UNIVERSIDAD DEL VALLE,ASOCIACIÓN IBEROAMERICANA DEL FILOSOFIA PRÁCTICA",2017
0000525278,"RECONOCIMIENTO DE PARTICIPACIÓN COMO DOCENTE EN DIPLOMADO,UNIVERSIDAD DEL CAUCA",2014
0000525278,"PAN-AFRICANISM AND NEGRITUDE: DIALOGUESS BETWEEN AFRICA AND AFRICAN DIASPORA (past, present future),Howard University´s",2015
0000525278,"CONTRIBUCIÓN AL PENSAMIENTO DIASPORICO,Colectivo Académico Manuel Saturio Valencia",2015
0000525278,"RECONOCIMIENTO POR SU INVALUABLE APORTE A LA INVESTIGACIÓN Y LITERATURA AFRO ,Oficina Presidnecial Para La Juventud - Colombia Joven- Gtz Y Unicef",2018
0000525278,"AFROCOLOMBIANO DEL AÑO,El espectador y color de colombia",2014
0000525278,"Reconocimiento por publicación de obra de Manuel Zapata Olivella ,University of North Carolina",2019
0000525278,"Beca de circulación internacional para creadores , investigadores y emprendedores del área de la literatura Ciclo II,Ministerio De Cultura De Colombia",2019
0000063138,"Beca ""Alianza del Pacífico"" ,UNIVERSIDAD AUTONOMA DEL ESTADO DE MORELOS",2016
0000063138,"Medalla Universidad del Cauca en la denominación ""CAMILO TORRES"",UNIVERSIDAD DEL CAUCA",2019
0000063417,"Matrícula de Honor,UNIVERSIDAD DEL CAUCA",2017
0000063417,"Media Matrícula de Honor  ,UNIVERSIDAD DEL CAUCA",2016
0000063417,"Media Matrícula de Honor,UNIVERSIDAD DEL CAUCA",2017
0000063417,"Universidad Nacional Autónoma de México. Estudiante de movilidad estudiantil ,UNIVERSIDAD NACIONAL AUTÓNOMA DE MÉXICO",2018
0000063417,"Media Matrícula de Honor ,UNIVERSIDAD DEL CAUCA",2019
0000063417,"Subvención por costos de matricula para movilidad académica en la Universidad Nacional Autónoma de México- UNAM,UNIVERSIDAD DEL CAUCA",2018
0000063417,"Media Matrícula de Honor ,UNIVERSIDAD DEL CAUCA",2019
0000063417,"Mención honorífica por trabajo de grado,UNIVERSIDAD DEL CAUCA",2022
0000063417,"Becaria Conacyt ,Consejo Nacional de Ciencia y Tecnología, CONACYT",2022
0000059269,"Ganador Desafío SmartSchool 2015,UNIVERSIDAD DEL CAUCA",2015
0000059269,"Ganador primer puesto reto JBG-Interacpedia,Laboratorios JGB",2017
0001614136,"Baca de movilidad academica entre instituciones asociadas a la AUIP ,Asociación Universitaria Iberoamericana de Posgrados - AUIP",2016
0000387614,"Grado de Honor Ingeniería de Sistemas y Computación,UNIVERSIDAD PEDAGÓGICA Y TECNOLÓGICA DE COLOMBIA",2000
0000387614,"Segundo Mejor Proyecto de Investigación en el Área Informática y Tecnologías de la Información,UNIVERSIDAD COOPERATIVA DE COLOMBIA",2009
0000012041,"Profesora distinguida,UNIVERSIDAD DEL CAUCA",2007
0000012041,"MEDALLA ALFONSO CASO,Universidad Nacional Autónoma de México UNAM",2019
0000012041,"Tesis meritoria,Universidad Nacional Autónoma de México UNAM",2018
0000012041,"Trayectoria investigativa, calidad de producción y excelencia cientifica ,UNIVERSIDAD DEL CAUCA",2019
0000012041,"Reconocimiento al grupo de investigación diseño y sociedad,UNIVERSIDAD DEL CAUCA",2019
0000012041,"Ganadores Convocatoria interna de apoyo a Semilleros de investigación Cultivando semillas 2018. Proyecto:Tramas gráficas. Itinerario conceptual del componente proyectual: Programa de Diseño Gráfico, Universidad del Cauca (2013-2018).,UNIVERSIDAD DEL CAUCA,UNIVERSIDAD DEL CAUCA",2018
0000012041,"Ganadora Convocatoria para la publicación de libros 2018. Sello Editorial Universidad del Cauca,UNIVERSIDAD DEL CAUCA",2019
0000062249,"Trabajo de grado laureado,UNIVERSIDAD DEL CAUCA",2016
0000880515,"Publicación de libros resultado de la investigación. Proyecto Innovacción Cauca. 2017,UNIVERSIDAD DEL CAUCA",2017
0000880515,"Nominación Premio Lápiz de Acero 2016. Categoría Concepto, Área: Impresos, Revista Proyecto Diseño,GrupoD Ltda",2016
0000880515,"Ganadores Convocatoria para la publicación de libros de impacto regional y nacional 2015-2016, Editorial Universidad del Cauca. Libro: Cuadernos tipográficos, Estudios y prácticas en torno a la Tipografía en el Suroccidente colombiano 2014 - 2016.,UNIVERSIDAD DEL CAUCA",2016
0000880515,"Ganadores Convocatoria para la publicación de libros de impacto regional y nacional 2017, Editorial Universidad del Cauca. Libro: Diseño, innovación social y prácticas locales ,UNIVERSIDAD DEL CAUCA",2017
0000011606,"Tesis Laureada,UNIVERSIDAD DEL CAUCA",2002
0000011606,"Investigación Terminada en el Área de Ciencias Naturales,Universidad de Antioquia y Semilleros de Investigación",1999
0000011606,"Mención Honorífica,UNIVERSIDAD DEL CAUCA",2016
0000011606,"Mención Honorífica ,UNIVERSIDAD DEL CAUCA",2017
0000011606,"Mención Honorífica,UNIVERSIDAD DEL CAUCA",2018
0000011606,"Reconocimiento a la mejor ponencia de trabajo de investigación modalidad oral presentada en el VI Congreso Colombiano de Fisiología,UNIVERSIDAD DE ANTIOQUIA",2017
0000011606,"Mención Honorífica a Trabajo de Grado de Pregrado,UNIVERSIDAD DEL CAUCA",2017
0000011606,"Distinción de Meritorio al Trabajo de Grado,UNIVERSIDAD DE NARIÑO",2019
0000348104,"Primer puesto Concurso de docentes departamentales en Ciencias Naturales,Secretaria De Educación Del Departamento Del Cauca",1987
0000348104,"Mención de honor a tesis de posgrado,Universidad del Cauca- Facultad de Ciencias Naturales",2005
0000348104,Mencion de honor a mejor trabajo de pregrado,2013
0000348104,"Mención de honor,Universidad del Cauca- Facultad de Ciencias Naturales",2014
0000348104,"Mencion honorifica,Museo De Historia Natural Universidad Del Cauca",2018
0000348104,"Mejor ponencia VI Congreso Colombiano de Fisiología,UNIVERSIDAD DE ANTIOQUIA",2017
0000408824,"Matrícula de honor por rendimiento académico en VI semestre de la carrera de biología,UNIVERSIDAD DEL CAUCA",2004
0000408824,"Mención de honor sugerida por el jurado evaluador del trabajo de grado realizado como requisito parcial para optar al título de Bióloga,UNIVERSIDAD DEL CAUCA",2008
0001341352,"RECONOCIMIENTO DE EXCELENCIA A LA PRESENTACIÓN DEL PÓSTER:Caracterización de la progresión de tumores derivados de pacientes en un modelo de pez cebra,UNIVERSIDAD DE LOS ANDES",2021
0001123467,"mensión de honor por su excelencia,COLEGIO SAGRADO CORAZON DE JESUS",2000
0001123467,"Mención de Honor por su Disciplina.,COLEGIO SAGRADO CORAZON DE JESUS",1998
0001123467,"Mención de Honor en Pintura.,Corporación Autónoma Regional del Cauca",1997
0000848743,"Matrícula de honor por distinción académica ,UNIVERSIDAD DE NARIÑO",2003
0000848743,"Matrícula de honor por distinción académica ,UNIVERSIDAD DE NARIÑO",2004
0000848743,"Matrícula de honor por distinción académica,UNIVERSIDAD DE NARIÑO",2004
0000848743,"Matrícula de honor por distinción académica,UNIVERSIDAD DE NARIÑO",2005
0000848743,"Matrícula de honor por distinción académica,UNIVERSIDAD DE NARIÑO",2005
0000848743,"Matrícula de honor por distinción académica,UNIVERSIDAD DE NARIÑO",2006
0000848743,"Matrícula de honor por distinción académica,UNIVERSIDAD DE NARIÑO",2006
0000848743,"Matrícula de honor por distinción académica,UNIVERSIDAD DE NARIÑO",2007
0000848743,"Matrícula de honor por distinción académica,UNIVERSIDAD DE NARIÑO",2007
0000848743,"Grado de Honor -Egresada Distinguida,UNIVERSIDAD DE NARIÑO",2010
0000848743,"Mejor Bachiller ,COLEGIO CIUDAD DE PASTO",2003
0000848743,"VIII Convocatoria Alberto Quijano Guerrero (financiación proyecto de investigación),UNIVERSIDAD DE NARIÑO",2006
0000848743,"IX Convocatoria Alberto Quijano Guerrero (financiación proyecto de investigación),UNIVERSIDAD DE NARIÑO",2007
0000848743,"Convocatoria Alberto Quijano Guerrero (financiación Trabajo de grado),UNIVERSIDAD DE NARIÑO",2009
0000848743,"Mejor promedio del Programa de Posgrado en Ciencias Biomédicas,UNIVERSIDAD DE COSTA RICA",2013
0000848743,"Mejor promedio de Maestría Académica del Área de la Salud ,UNIVERSIDAD DE COSTA RICA",2013
0000848743,"Tesis Mención de honor. Maestría en Ciencias Biomédicas con Énfasis en Bioquímica y Fisiología Celular.,UNIVERSIDAD DE COSTA RICA",2014
0000848743,"Graduación de honor. Maestría en Ciencias Biomédicas con Énfasis en Bioquímica y Fisiología Celular. ,UNIVERSIDAD DE COSTA RICA",2014
0000848743,"Beca de estímulo (II ciclo 2011),UNIVERSIDAD DE COSTA RICA",2011
0000848743,"Beca de estímulo (II ciclo 2012),UNIVERSIDAD DE COSTA RICA",2012
0000848743,"Beca de estímulo (I y II ciclo 2013),UNIVERSIDAD DE COSTA RICA",2013
0000848743,"Beca de estímulo (I ciclo 2014),UNIVERSIDAD DE COSTA RICA",2014
0000848743,"Tesis Doctoral Cum Laude. Doctorado en Biomedicina y Biotecnología.,Universidad de Valencia",2021
0000848743,"Tesis meritoria,UNIVERSIDAD DE NARIÑO",2019
0000848743,"Tesis meritoria,UNIVERSIDAD DE NARIÑO",2023
0001212117,"MEJOR PÓSTER. I JORNADA DE INVESTIGACIÓN FACULTAD DE MEDICINA. UNIVERSIDAD NACIONAL DE COLOMBIA. ,UNIVERSIDAD NACIONAL DE COLOMBIA SEDE BOGOTA",2009
0001212117,"Mejor Docente. Posgrado de Pediatría-Fundación Universitaria Sanitas.,Sociedad Colombiana de Pediatría Regional Bogotá",2015
0001212117,"Segundo puesto a mejor exposición: modalidad póster. II Encuentro Científico Revista MED,UNIVERSIDAD MILITAR NUEVA GRANADA",2018
0001212117,"Aporte a la Formación médica,Asociación Nacional de Internos y Residentes-Regional Centro",2016
0001212117,"Excelencia Docente,CRUZ ROJA COLOMBIANA SECCIONAL CUNDINAMARCA Y BOGOTA D.C",2008
0001212117,"Moneda Nueva Granada,UNIVERSIDAD MILITAR NUEVA GRANADA",2021
0001446912,"Mención Honorífica por Trabajo de Grado,UNIVERSIDAD DEL CAUCA",2014
0001446912,"Ganador del Segundo Concurso Nacional de Investigación en Fisiología, en el VII Congreso Colombiano de Fisiología",2019
0001444864,"Premio BIOS 2012 - Biólogo Investigador, Orgullo y Saber por su desempeño en el componente disciplinar zoologia,UNIVERSIDAD DEL CAUCA",2012
0001444864,"Premio BIOS 2013 - Biólogo Investigador, Orgullo y Saber por su desempeño en el componente disciplinar Biología Celular y Molecular",2013
0000109512,"Trabajo de Grado con Mención de Honor. Determinación del Efecto Cardiotóxico sobre Rattus norvegicus Cepa Wistar Causado por el Veneno de Lachesis acrochorda (SERPENTES: VIPERIDAE),UNIVERSIDAD DEL CAUCA",2016
0000130685,"Tercer lugar, modalidad Poster experimental con el trabajo de Investigación ¿Método de evaluación del psicópata a través de su conducta en la relación de pareja¿ ,UNIVERSIDAD AUTONOMA DE DURANGO - MEXICO",2017
0000130685,"Segundo lugar, modalidad Poster bibliográfico con el trabajo de Investigación ¿Tratamiento con base a Camellia Sinesis en pacientes con Alzheimer¿,Universidad Autónoma de Zacatecas",2017
0000130685,"Reconocimiento por haber obtenido el mejor promedio de la generación en el año 2014 en el programa de Doctorado en Ciencias en la especialidad en Farmacología Médica y Molecular,Universidad Autónoma de Zacatecas",2014
0000130685,"Mención honorifica por ¿Efecto de Rosmarinus officinalis L. sobre el estrés oxidativo, la expresión del gen Rbp1 y metilación de su promotor en cirrosis alcohólica experimental¿ ,Universidad Autónoma de Zacatecas",2014
0000130685,"Semifinalista de la ponencia ¿Efecto de Rosmarinus officinalis en cambios epigenéticos, oxidativos y expresión de citoqueratinas en cirrosis alcohólica experimental, evitando transición a cáncer hepatocelular¿, XXXVI Congreso Nacional de Farmacología, rea,Instituto Politécnico Nacional",2014
0000130685,"Coordinadora del Primer Seminario de Investigación en Ciencias Biomédicas escuela de Medicina,Universidad Autónoma de Durango",2017
0000130685,"Coordinadora del Curso ¿Modelado Farmacológico¿, Escuela de Medicina,Universidad Autónoma de Durango",2017
0000130685,"Coordinadora del Curso ¿Fortalecimiento de la Investigación en Zacatecas: Incorporación Nacional de Investigadores y Cátedras CONACYT,Universidad Autónoma de Durango",2017
0000130685,"Coordinador de mesa de la sección III de trabajos libres modalidad Oral, en las XXVI Jornadas Médicas,Universidad Autónoma de Zacatecas",2014
0000130685,"Participación activa en el Comité Científico de las XXVI Jornadas Médicas,Universidad Autónoma de Zacatecas",2014
0001613479,"Tesis Sobresaliente ,UNIVERSIDAD TECNOLÓGICA DE PEREIRA",2022
0000217441,"Moción de Felicitación,UNIVERSIDAD DEL CAUCA",2001
0000217441,"Compromiso, profesionalismo y dedicación,UNIVERSIDAD DEL CAUCA",2019
0001452001,Mención de honor,2011
0001528153,"Mención Honorífica a un Trabajo de Grado,UNIVERSIDAD DEL CAUCA",2014
0001528153,"Beca para estudios de Maestría,Colfuturo",2016
0001528153,"Mención de honor en Tesis de Maestría,PONTIFICIA UNIVERSIDAD JAVERIANA",2019
0001471424,"Premio BIOS,UNIVERSIDAD DEL CAUCA",2012
0001471424,"Mejor ponencia de trabajo de investigación modalidad oral presentada en el VI congreso Colombiano de fisiología ,UNIVERSIDAD DE ANTIOQUIA",2017
0001122398,"Incubadora de talentos I+D+i,INNOVACCIÓN CAUCA",2018
0001122398,"Mención honorífica,UNIVERSIDAD DEL CAUCA",2019
0001122398,"Segundo lugar póster Encuentro Interno de Semilleros de Investigación UNICAUCA 2018,UNIVERSIDAD DEL CAUCA",2018
0001122398,"RECONOCIMIENTOS Y DISTINCIONES PONENCIAS DESTACADAS,Fundacion Red Colombiana de Semilleros de Investigacion RedColsi - Nodo Bogota",2020
0001341358,"Beca Maestría Conacyt-Zacatecas (FOMIX-ZAC)-México,Universidad Autónoma de Zacatecas",2011
0001341358,Becas de Excelencia Doctoral del Bicentenario,2021
0000037411,"EGRESADO ILUSTRE,UNIVERSIDAD DEL CAUCA",2018
0000037411,"RECONOCIMIENTO  POR SU DESTACADA PARTICIPACIÓN COMO PONENTE, PONENCIA EN LA CONFERENCIA DE ""PLANEACION FINANCIERA"". IMPARTIDA A LA CARRERA INGENIERÍA INDUSTRIAL.,TECNOLÓGICO SUPERIOR ZACATECAS OCCIDENTE",2022
0000037411,"RECONOCIMIENTO POR SU DESTACADA PARTICIPACIÓN COMO PONENTE EN LA CONFERENCIA ""LA ADMINISTRACIÓN Y LOS NEGOCIOS INTERNACIONALES"", IMPARTIDA A LA CARRERA LICENCIATURA EN ADMINISTRACIÓN.,TECNOLÓGICO SUPERIOR ZACATECAS OCCIDENTE",2022
0000037411,"RECONOCIMIENTO POR SU VALIOSO APOYO IMPARTIENDO EL TEMA: ""PANORAMA GENERAL DE INVESTIGACIÓN"" EN LA CARRERA GESTIÓN EMPRESARIAL.,TECNOLÓGICO SUPERIOR ZACATECAS OCCIDENTE",2022
