idcvlac,nombre,fecha
0000012890,"Reconocimiento especial en el Centenario de Caicedonia Valle del Cauca,Concejo Municipal de Caicedonia",2010
0000012890,"Profesor Eminente,UNIVERSIDAD DEL CAUCA",2013
0001427275,"Excelencia Académica,SAGRADO CORAZON DE JESUS",2002
0001427275,"Media Matrícula de Honor,UNIVERSIDAD DEL CAUCA",2003
0001422434,"Matrícula de honor por alto rendimiento académico,UNIVERSIDAD DEL CAUCA",2004
0001422434,"Matrícula de honor por alto rendimiento académico,UNIVERSIDAD DEL CAUCA",2004
0001422434,"Media matrícula de honor por alto rendimiento académico,UNIVERSIDAD DEL CAUCA",2005
0001422434,"Media matrícula de honor por alto rendimiento académico,UNIVERSIDAD DEL CAUCA",2008
0001422434,"Media matrícula de honor por alto rendimiento académico,UNIVERSIDAD DEL CAUCA",2008
0001422434,"ACM SIGCOMM Travel Grant,Association for Computing Machinery",2019
0001239368,"Sexto puesto en la segunda Maratón de programación de aplicaciones móviles e Inalámbricas,CINTEL, NOKIA y COMCEL",2005
0001239368,"Universitarios Destacados año 2005 - Res. 645 de 2005,UNIVERSIDAD DEL CAUCA",2005
0001239368,"Mención de honor al trabajo de grado Arquitectura para la Distribución de Procesos de Negocio Empresariales en Sistemas Móviles de Información, Res. 003, 14 de Febrero de 2008,UNIVERSIDAD DEL CAUCA",2008
0001239368,"Jóven Investigador e Innovador Año 2008,Ministerio de Ciencia, Tecnología e Innovación",2008
0001239368,Invited Papers Euro American Conference on Telematics and Information Systems,2010
0001239368,"COOPEN Erasmus Mundus ECW Grant,Colombia Costa Rica Panama European Networks",2010
0001239368,"Convocatoria 511 Beca crédito Condonable para Doctorados Nacionales,Ministerio de Ciencia, Tecnología e Innovación",2011
0001239368,"Mención de honor al trabajo doctoral Recommender Systems based on Linked Data. Resolución 8.4.2-90.14/224 de 2017,UNIVERSIDAD DEL CAUCA",2017
0001427333,"Mencion de Honor por el mejor ICFES de La Union Nariño,COLEGIO NACIONAL JUANAMBÚ",2002
0001427333,"Invited paper - distinguished among the 10 better submited papers,Universidade Do Algarve",2010
0001427333,"Proyecto de investigación financiable. elegible dentro de la V Convocatoria de Apoyos a Proyectos de Investigación,UNIVERSIDAD DEL CAUCA",2012
0001427333,"Mención de Honor por el mejor ICFES,COLEGIO NACIONAL JUANAMBÚ",2002
0001427600,"Tesis Laureada,UNIVERSIDAD DEL CAUCA",2021
0000013064,"Premio a Mejor ponencia Seminario Internacial Tecnologías Internet,Departamento de Sistemas- Universidad del Cauca",2001
0000013064,"Beca Programa ALBAN para Estudios de Postgrado de Alto nivel en Europa,Union Europea",2003
0000013064,"Beca Fulbright . Porgrama de Desarrollo Universitario (No Disfrutada),Comisión Fullbright",2003
0000013064,"Integrante Proyecto ganador del Stockholm Challenge Award 2004,Ayuntamiento de Estocolmo (Suecia)",2004
0000013064,"Matricula de Honor, Facultad de Ingeniería Electrónica y Telecomunicaciones,UNIVERSIDAD DEL CAUCA",1995
0000013064,"Media Matricula de Honor, Facultad de Ingeniería Electrónica y Telecomunicaciones,UNIVERSIDAD DEL CAUCA",1996
0000013064,"Matricula de Honor, Facultad de Ingeniería Electrónica y Telecomunicaciones,UNIVERSIDAD DEL CAUCA",1997
0000013064,"Beca de Doctorado,DAAD- German Academic Exchange Service",2007
0000013064,"Mejor Ponencia y Trabajo de Investigación en el Congreso Mundial de Informática para la Salud (Medinfo 2007). Categoría Estudiante Postgrado,Asociación Internacional de Informática Médica",2007
0000013064,"Finalista Concurso Mejor Artículo de Investigación en la Conferencia Europea de Informática Médica 2008 (Segunda Mejor Evaluación por el Comité Científico de la Conferencia MIE2008),EFMI-European Federation of Medical Informatics",2008
0000013064,"Profesional del año 2013 ACOPI Cauca,Asociación Colombiana de Pequeña y Media Empresa - Seccional Cauca",2013
0000013064,"Mención honorífica para trabajo de grado ,UNIVERSIDAD DEL CAUCA",2014
0000331589,"Aval Internacional - Encuentro Latinoamericano de Semilleros, Grupos y Líderes de Investigación,FUNDACIÓN RED LATINOAMERICANA DE JOVENES E INVESTIGADORES",2019
0000331589,"Moción de Felicitación y Reconocimiento - reflexión curricular de la Facultad de Ingeniería Electrónica y Telecomunicaciones,UNIVERSIDAD DEL CAUCA",2021
0000331589,"Moción de Felicitación y Reconocimiento - Acreditación de Alta Calidad del Programa Tecnología en Telemática,UNIVERSIDAD DEL CAUCA",2020
0000331589,"Placa de reconocimiento - Coordinadora del Semillero de Emprendimiento e Innovación StartTic,UNIVERSIDAD DEL CAUCA",2017
0000331589,"Resolución VRI 374 de 2017 - Reconocimiento a Coordinadora de un Semillero de Investigación de la Universidad del Cauca,UNIVERSIDAD DEL CAUCA",2017
0000331589,"Moción de Felicitación y Reconocimiento - Todos podemos programar 2015 ,UNIVERSIDAD DEL CAUCA",2015
0000331589,"Moción de Felicitación y Reconocimiento - Todos podemos programar 2016,UNIVERSIDAD DEL CAUCA",2016
0000331589,"Moción de Agradecimiento y Felicitación - Popayán i: inteligente, incluyente e innovadora 2017,UNIVERSIDAD DEL CAUCA",2017
0000331589,"Primer puesto entre los graduados de la promoción de Ingeniería Electrónica y Telecomunicaciones,UNIVERSIDAD DEL CAUCA",2004
0000331589,"Promedio 4,5 en el Programa Ingeniería Electrónica y Telecomunicaciones,UNIVERSIDAD DEL CAUCA",2004
0000331589,"Profesor Revelación,Idea Minds Group SAS",2017
0000948845,"Mención Honorífica, al trabajo de grado titulado: ""Análisis, modelamiento y comprobación en vuelo de la dinámica de una aeronave subsónica a escala"",UNIVERSIDAD DEL CAUCA",2005
0000948845,"Beca de Excelencia Doctoral del Bicentenario I-2019,Ministerio de Ciencia, Tecnología e Innovación - Minciencias",2019
0001191551,"DISTINCION DE EXCELENCIA POR COMPROMISO Y LABORES,UNIVERSIDAD LIBRE SECCIONAL CALI",2007
0001191551,"Instructor 10 Years of Service ,Cisco System",2015
0001191551,"Expert Level instructor excellence,Cisco Systems Colombia",2013
0001191551,"Advanced Level instructor excellence,Cisco Systems Colombia",2012
0001191551,"Expert Level instructor excellence,Cisco Systems Colombia",2015
0001191551,"Instructor 5 Years of Service,Cisco Systems Colombia",2013
0001191551,"Mención Honorifica,UNIVERSIDAD LIBRE SECCIONAL CALI",2017
0001191551,"Reconocimiento por dedicación y compromiso,UNIVERSIDAD DEL VALLE",2015
0000352675,"Nokia Developer Champion,Nokia Corporation",2012
0000352675,"Media Matrícula de Honor Programa Ingeniería Electrónica y Telecomunicaciones,UNIVERSIDAD DEL CAUCA",1998
0000352675,"Matrícula de Honor Programa Ingeniería Electrónica y Telecomunicaciones,UNIVERSIDAD DEL CAUCA",1999
0000352675,"Matrícula de Honor Programa Ingeniería Electrónica y Telecomunicaciones,UNIVERSIDAD DEL CAUCA",1999
0000352675,"Media Matrícula de Honor Programa Ingeniería Electrónica y Telecomunicaciones,UNIVERSIDAD DEL CAUCA",2000
0000352675,"Matrícula de Honor Programa Ingeniería Electrónica y Telecomunicaciones,UNIVERSIDAD DEL CAUCA",2001
0000352675,"Matrícula de Honor Programa Ingeniería Electrónica y Telecomunicaciones,UNIVERSIDAD DEL CAUCA",2001
0000352675,"Nokia Developer Champion,Nokia Corporation",2013
0000352675,"Mención de honor tesis doctoral ""Sistema de recomendaciones soportado en un esquema de cooperación Smart TV - Smartphone para entornos de publicidad ubicua"",UNIVERSIDAD DEL CAUCA",2016
0000352675,"Nokia Developer Champion,Nokia Corporation",2013
0000381250,"DISTINCIÓN ANDRES BELLO Mejores pruebas ICFES municipio de Piendamó,Icetex - Instituto Colombiano De Crédito Educativo",1994
0000381250,"MENCIÓN HONORÍFICA al trabajo de grado,UNIVERSIDAD DEL CAUCA",2020
0000012670,"Mejor ponencia en Telecomunicaciones. I Congreso Internacional de Ingenierías Eléctrica y Electrónica,UNIVERSIDAD  INDUSTRIAL DE SANTANDER",2000
0000013056,"Mención de Honor por Trabajo de Grado,UNIVERSIDAD DEL CAUCA",2001
0000013056,"Beca Doctoral,Programa Alban",2007
0000013056,"Mención de honor mejor ponencia,XVIII Encuentro Nacional de Semilleros de Investigación",2000
0000013056,"APPLICATION FINALIST. Touching the Future: NFC Forum Global Competition.,NFC Forum",2008
0000013056,"Mención de Honor al mérito pedagógíco e investigativo,Red Iberoamericana de Pedagogía",2012
0001427278,"Beca-Pasantia Joven Investigador e Innovador Colciencias 2011,Ministerio de Ciencia, Tecnología e Innovación",2011
0001427278,"Reconocimiento por el excelente desempeño en el área de investigación, innovación y emprendimiento,Universidad Antonio Nariño, Popayán",2018
0001481137,"Fondo Emprender,SERVICIO NACIONAL DE APRENDIZAJE SENA",2018
0001481137,"Empresario destacado ValleE,Cámara De Comercio De Cali - C.C.C",2019
0000012947,"Beca para estudios de Doctorado,Ministerio de Ciencia, Tecnología e Innovación",1997
0000012947,"Obtención de la máxima calificación otorgada a una tesis doctoral en España: Sobresaliente Cum Lude por unanimidad,UNIVERSIDAD POLITÉCNICA DE MADRID",2001
0000012947,"Máxima Calificación tesis de pregrado,Facultad Ingeniería Electrónica y Telecommunicaciones - UNICAUCA",1995
0000012947,"Matricula de Honor,Facultad Ingeniería Electronica y Telecomunicaciones",1990
0000012947,Matrícula de Honor,1991
0000012947,Matrícula de Honor,1992
0000012947,Matrícula de Honor,1993
0000012947,Matrícula de Honor,1994
0000012947,"Campeon Departamental Olimpiadas Nacionales de Matématicas,Concurso Nacional de Olimpiadas Matemáticas",1989
0000082749,"Mejor estudiante Saber PRO,Instituto Colombiano para la Evaluación de la Educación",2014
0000082749,"Mención Honorífica al trabajo de grado,UNIVERSIDAD DEL CAUCA",2016
0000013161,"Mejor objeto de aprendizaje presentado en el Congreso Tecnologías aplicadas a la enseñanza de la electrónica TAEE,ALFA/CITA2",2006
0000013161,"Tesis de maestría con mención de honor: Patrones pedagógicos para el diseño y desarrollo de cursos en línea en la Universidad del Cauca,UNIVERSIDAD DEL CAUCA",2009
0000875830,"Mejor puntaje en prubas del ICFES Colegio Sagrado Corazón de Jesús,COLEGIO SAGRADO CORAZON DE JESUS",1992
0000875830,Media Beca por mejor promedio,1997
0000352683,"Reconocimiento Público,ACOPI CAUCA",2006
0000352683,"IETF Fellowship,Inernet Society",2015
0000352683,"ACM SIGCOMM Travel Grant,Association For Computing Machinery",2016
0000352683,"TESIS LAUREADA - Carlos Tobar,UNIVERSIDAD DEL CAUCA",2022
0000352683,"Tesis Laureada - Ana Montoya,UNIVERSIDAD DEL CAUCA",2022
0000352683,Tesis Laureada - Felipe Estrada,2022
0000352683,"Tesis Laureada - Angela Rodriguez,UNIVERSIDAD DEL CAUCA",2023
0000013030,"Reconocimiento a la Labor Académica Desarrollada,UNIVERSIDAD DEL CAUCA",1996
0000013030,"Mención Honórifica al Trabajo de Grado de Maestria,UNIVERSIDAD DEL CAUCA",1989
0000384003,"Trabajo Laureado,UNIVERSIDAD DEL CAUCA",2021
0000384003,"Mención de honor,UNIVERSIDAD DEL CAUCA",2022
0000012963,"Grupo de Excelencia - Grupo de Ingeniería Telemática Universidad del Cauca,Ministerio de Ciencia, Tecnología e Innovación",1997
0000012963,"Matricula de Honor,Facultad de Ingeneiria Electrónica y Telecomunicaciones Universidade del Cauca",1983
0000012963,"Matricula de Honor,Facultad de Ingeneiria Electrónica y Telecomunicaciones Universidade del Cauca",1984
0000012963,"Matricula de Honor,Facultad de Ingeneiria Electrónica y Telecomunicaciones Universidade del Cauca",1985
0000012963,"Media Matricula,Facultad de Ingeneiria Electrónica y Telecomunicaciones Universidade del Cauca",1987
0000253375,"cum laude,Universidad de Oviedo - España",2017
0000253375,"Cum Laude,Universidad De Oviedo",2017
0001538928,"premio a mejor trabajo en modalidad de poster al trabajo de grado titulado  extracción enzimática de aceite a partir de subproductos de trucha arcoíris,UNIVERSIDAD DEL TOLIMA",2015
0001519135,"Trabajo de grado con mención Laureada ,Universidad Cesmag",2012
0001519135,"Mención de Honor ,Apisred S.A.S",2015
0001519135,"participación como ponente  en Producción de video mapping, arte y tecnologÍa emergente en la publicidad digital, en el evento innovando y creando con las TIC,SERVICIO NACIONAL DE APRENDIZAJE SENA",2016
0000427047,"Mension de honor,UNIVERSIDAD DEL CAUCA",2004
0000427047,"Apoyo proyecto Fondo Emprender,SERVICIO NACIONAL DE APRENDIZAJE SENA",2014
0000427047,"Condonación deuda Fondo Emprender,SERVICIO NACIONAL DE APRENDIZAJE SENA",2016
0000083042,"Becario en Universidad de Brasilia,UNIVERSIDAD DE BRASILIA",2014
0001559604,"Ganadores de la Segunda Convocatoria de estímulos a proyectos de Cultura y Bienestar 2015. Proyecto: VI Bienal latinoamericana de tipografía Tipos Latinos 2014 - Popayán.,UNIVERSIDAD DEL CAUCA",2015
0001559604,"Ganadores IX Convocatoria de apoyo a proyectos de investigación, desarrollo tecnológico e investigación-creación artística. Modalidad: Investigación-creación para las Artes. Proyecto: Entre Plomos 1,UNIVERSIDAD DEL CAUCA",2014
0001559604,"Ganadores Convocatoria de proyectos SENNOVA 2020,Servicio Nacional De Aprendizaje Sede Popayan",2019
0001559604,"Ganadores Convocatoria de proyectos SENNOVA 2021,Servicio Nacional De Aprendizaje Sede Popayan",2020
0001364033,"Idea Imnovadora, diplomado en gerencia social y proyecto autogestionarios solidarios,UNIVERSIDAD COOPERATIVA DE COLOMBIA",2009
0001364033,"Beneficiario del programa Jovenes investigadores e innovadores ""Virginia Gutierrez de Pineda"",Instituto Colombiano Para El Desarrollo De La Ciencia Y La Tecnología ""Francisco José De Caldas"" - Colciencias - ,Ministerio de Ciencia, Tecnología e Innovación",2010
0001364033,"Beneficiario de la convocatoria para estudios de doctorado en Colombia año 2011,Ministerio de Ciencia, Tecnología e Innovación",2012
0001364033,"In appreciation for your contribution to the development of a conceptual framework and methods to analyze environmental issues in agriculture,University Of Nebraska",2015
0001364033,"Premio BIOS 2015, por su excelente desempeño en sus estudios doctorales en Ciencias Ambientales,UNIVERSIDAD DEL CAUCA",2015
0000723703,"Mención Honorífica Trabajo de Grado,UNIVERSIDAD DEL CAUCA",2005
0000723703,"Premio BIOS - Biólogo Investigador, Orgullo y Saber,UNIVERSIDAD DEL CAUCA",2010
0000723703,"Tesis doctoral sobresaliente Cum Laude,UNIVERSIDAD DEL CAUCA",2017
0001421557,Relación en los procesos de investigación aplicada de los aprendices vinculados al semillero SINERGIA,2017
0000266981,"Mencion de honor,UNIVERSIDAD ANTONIO NARIÑO",2003
0000124628,"Por su participación como ponenete en XI Encuentro Departamental de Semilleros de Investigación.,Servicio Nacional De Aprendizaje Sede Popayan",2017
0000124628,"Ponente y expositor de proyecto Diseño de una metodologia para evaluación de la calidad de los productos Software ,Servicio Nacional De Aprendizaje Sena Regional Atlantico",2018
0000124628,"Ponente en evento académico,Fundacion Red Colombiana de Semilleros de Investigacion RedColsi -  Nodo Bucaramanga",2017
0000160754,"Media matrícula de honor ,UNIVERSIDAD DEL CAUCA",2017
0000160754,"Media matrícula de honor ,UNIVERSIDAD DEL CAUCA",2018
0000160754,"Reconocimiento por destacada participación en actividades de investigación y divulgación en los proyectos SENNOVA año 2020.,Servicio Nacional De Aprendizaje Sede Popayan",2020
0000160754,"Ganadores Convocatoria de proyectos SENNOVA 2021,Servicio Nacional De Aprendizaje Sede Popayan",2020
0000214108,"Reconocimiento al Grupo de Investigación,UNIVERSIDAD PEDAGÓGICA Y TECNOLÓGICA DE COLOMBIA",2002
0000063913,"Por el Fortalecimiento en los procesos de investigación aplicada a los aprendices vinculados al Semillero SINERGIA,Servicio Nacional De Aprendizaje Sede Popayan",2017
0000063913,"Destacada participación en la actividades programadas por el Área de Innovación y Competitividad del CEAI durante la vigencia 2020,Servicio Nacional de Aprendizaje Sena Sede Cali",2020
0001580379,"La unidad de atención del ciudadano del Instituto Colombiano para la evaluación de la Educación ICFES certifica que hace parte del listado de mejores estudiantes SABER PRO,Instituto Colombiano para la Evaluación de la Educación",2016
0001580379,"Moción de felicitación N°13,UNIVERSIDAD DEL CAUCA",2016
0001433528,"Finalista Nacional Imagine Cup 2009,Microsoft Colombia",2009
0001433528,"Obtención de media matrícula de honor,UNIVERSIDAD DEL CAUCA",2007
0001433528,"Mejor Pruebas ICFES,ANTONIO GARCIA PAREDES",2003
0001433528,"Proyecto sobresaliente a nivel regional, Proyecto: Herramienta TIC para aprendices sordos del centro de comercio y servicios SENA Regional Cauca.,Fundacion Red Colombiana de Semilleros de Investigacion RedColsi - Nodo Bogota",2017
0001433528,"Aval internacional, proyecto: Herramientas TICs para aprendices sordos del centro de comercio y servicios,Fundacion Red Colombiana de Semilleros de Investigacion RedColsi - Nodo Bogota",2018
0001433528,"2º lugar na área de Ciências da Computação - Mostra Brasileira e Internacional de Ciência e Tecnologia,Mostra Brasileira e Internacional de Ciência e Tecnologia",2018
0001433528,"3º lugar Destaque Internacional - Mostra Brasileira e Internacional de Ciência e Tecnologia,Mostra Brasileira e Internacional de Ciência e Tecnologia",2018
0001433528,"Proyecto sobresaliente a nivel regional, Proyecto: Herramienta TIC para aprendices sordos del centro de comercio y servicios SENA Regional Cauca (Fase 2),Fundacion Red Colombiana de Semilleros de Investigacion RedColsi - Nodo Bogota",2018
0001433528,"Proyecto sobresaliente a nivel regional, Proyecto: Uso de realidad virtual como herramienta pedagógica para aprendices sordos del Centro de comercio y servicios, SENA regional Cauca.,Fundacion Red Colombiana de Semilleros de Investigacion RedColsi - Nodo Bogota",2018
0000349925,"Investigador Junior,UNIVERSIDAD DEL CAUCA",2018
0000349925,"Investigador Junior,Ministerio de Ciencia, Tecnología e Innovación - Minciencias",2021
0000344206,"Mejor Lote Productivo,PROANDEX LTDA",2002
0001492133,"Media matricula de honor,UNIVERSIDAD DEL CAUCA",2014
0001492133,"Becario Maestrías Nacionales. Universidad del Cauca. Convocatoria 02-2016 del proyecto ¿Desarrollo Tecnológico para la Obtención de Productos Orgánicos e Innovadores de Seda Natural¿.,UNIVERSIDAD DEL CAUCA",2016
0000349917,"Apoyo en la realización del Proyecto Piloto de Excelencia Sanitaria en Ganadería Bovina de Doble Propósito en los municipios de Popayán y Puracé  (Cauca),La empresa colombiana de productos veterinarios Vecol S.A",2017
0000349917,"Exaltación  por contribución en el programa de la Facultad de Medicina Veterinaria de la Universidad Antonio Nariño,Universidad Antonio Nariño, Popayán",2017
0000019968,"Premio BIOS-unicauca 2011 por buen desempeño académico en los periodos II-2010 y I-2011,UNIVERSIDAD DEL CAUCA",2011
0000019968,"Premio BIOS-unicauca 2013 por buen desempeño académico en el II Periodo Académico de 2012,UNIVERSIDAD DEL CAUCA",2013
0000019968,"Premio BIOS-unicauca 2013 por buen desempeño académico en el Examen de Estado de Calidad de la Educación Superior, SABER PRO 2013,UNIVERSIDAD DEL CAUCA",2013
0000102023,"Reconocimiento de Matrícula de honor,UNIVERSIDAD DEL CAUCA",2016
0000102023,"Reconocimiento de Matrícula de honor,UNIVERSIDAD DEL CAUCA",2017
0000102023,"Reconocimiento de Media Matrícula de honor,UNIVERSIDAD DEL CAUCA",2018
0000102023,"Reconocimiento de Matrícula de honor,UNIVERSIDAD DEL CAUCA",2018
0000693669,"Felicitaciones por trabajo de Investigación de Maestría,Colegio De Posgraduados",1999
0000693669,"Recognition of outstanding contribution as graduate student to all aspects of on-going activities of the CIMMYT Applied Biotechnology Center. CIMMYT Int,Centro Internacional De Mejoramiento De Maíz Y Trigo",2000
0000693669,"Distinción Universitaria por trabajo de Investigación,UNIVERSIDAD DEL CAUCA",2010
0000693669,"Premio Santander: en la Modalidad de Ciencia e Innovación ,Banco Santander",2008
0000693669,"Distinción Docente Universitario 2002,UNIVERSIDAD DEL CAUCA",2002
0000693669,"Distinción Docente Universitario 2004,UNIVERSIDAD DEL CAUCA",2004
0000693669,"Universitarios Destacados año 2005,UNIVERSIDAD DEL CAUCA",2005
0000693669,"Reconocimiento por crear el primer Programa de Posgrado de la Facultad de Ciencias Agropecuarias,UNIVERSIDAD DEL CAUCA",2013
0000693669,"Investigadora destacada del mes de Junio de 2015,UNIVERSIDAD DEL CAUCA",2016
0000693669,"Cauca se impulsa y le marca el paso a la Ciencia, Tecnología e Innovación,UNIVERSIDAD DEL CAUCA",2015
0000693669,"Mención de honor a un trabajo de grado,UNIVERSIDAD DEL CAUCA",2014
0000693669,tesis meritoria,2021
0000069578,"mención honorifica,UNIVERSIDAD DEL CAUCA",2020
0000349640,"Reconocimiento por crear el primer Programa de Posgrado de la Facultad de Ciencias Agropecuarias,UNIVERSIDAD DEL CAUCA",2013
0000936219,"Reconocimiento como el mejor docente del Centro de Educación Abierta y a Distancia de la Universidad del Cauca,UNIVERSIDAD DEL CAUCA",2005
0000936219,"Reconocimiento como el mejor docente del Centro de Educación Abierta y a Distancia de la Universidad del Cauca,UNIVERSIDAD DEL CAUCA",2007
0000936219,"Mejor evaluación del año 2015,Centro De Informacion Tecnologica",2016
0000936219,"Compromiso editorial y aportes de la revista Biotecnología en el sector agropecuario y agroindustrial, en la divulgación de las ciencias agropecuarias, el desarrollo científico y la transferencia de conocimiento para la comunidad académica y la sociedad,UNIVERSIDAD DE ANTIOQUIA",2019
0000936219,"Mejor evaluación del año 2019,Centro de Información Tecnológica (CIT)",2016
0001520296,"MENCIÓN DE HONOR POR SER MEJOR BACHILLER,INSTITUCIÓN EDUCATIVA MISAEL PASTRANA BORRERO",2008
0001520296,"MENCIÓN DE HONOR POR RENDIMIENTO ACADEMICO,INSTITUCIÓN EDUCATIVA MISAEL PASTRANA BORRERO",2008
0001520296,"MEDIA MATRICULA DE HONOR,UNIVERSIDAD DEL CAUCA",2012
0001520296,"Exceción de pago en posgrado ,Universidad Nacional de Colombia - Sede Palmira",2019
0001344116,"Trayectoria profesional y valiosa contribución como PONENTE en el XVI Congreso Nacional de Estudiantes de Ingeniería Agroindustrial y II Congreso Internacional de Ingeniería Agroindustrial,Universidad Nacional Hermilio Valdizán",2015
0001344116,"Orgullo nariñense por el aporte en la transformación y construcción de la región. Sector Ciencia,FUNDACIÓN CONTRUCCIÓN COLOMBIA",2016
0001006339,"Matricula de  honor,UNIVERSIDAD DEL CAUCA",2001
0001006339,"Matricula de honor,UNIVERSIDAD DEL CAUCA",2002
0001006339,"Matricula de honor,UNIVERSIDAD DEL CAUCA",2004
0001006339,"Matricula de honor,UNIVERSIDAD DEL CAUCA",2005
0001006339,"Mencion Mejor Estudiante de la Facultad de Ciencias Agropecuarias,UNIVERSIDAD DEL CAUCA",2005
0000065278,"HONOR  CODE CERTIFICATE - ASOCIACIONES PUBLICO PRIVADAS IMPLEMENTANDO SOLUCIONES EN LATINO AMERICA Y EL CARIBE ,Banco Interamericano de Desarrollo",2015
0000065278,"HONOR CODE CERTIFICATE LIDERENDO EL DESARROLLO SOSTENIBLE DE LAS CIUDADES ,Banco Interamericano de Desarrollo",2015
0000065278,"HONOR CODE CERTIFICATE INTRODUCCION A LA GESTION DE PROYECTOS,UNIVERSIDAD POLITÉCNICA DE VALENCIA - INTERNACIONAL",2015
0001398837,"Tercer Lugar, Modalidad estudiante. Concurso ¿Yo soy UN emprendedor¿,Universidad Nacional de Colombia - Sede Palmira",2011
0001398837,"Beca curso de Gestores Energéticos,Universidad Nacional de Colombia - Sede Palmira",2012
0001398837,"Admision automática a un posgrado en la Universidad Nacional de Colombia por mejor promedio de graduados.,Universidad Nacional de Colombia - Sede Palmira",2013
0001398837,"Becaria Coordenação de Aperfeiçoamento de Pessoal de Nível Superior (CAPES) Maestria en Ingenieria de Alimentos en Universidade Estadual de Campinas, São Paulo. ,UNICAMP",2015
0001398837,"Becaria Conselho Nacional de Desenvolvimento Científico e Tecnológico (CNPq) Doctorado en Ingeniería de Alimentos en Universidade Estadual de Campinas, São Paulo. ,UNICAMP",2017
0001398837,"Beca curso Novel oils for a new nutrition. Towards an improved nutritional quality of edible oils: innovation and challenges,UNIVERSIDAD DE CHILE",2018
0001398837,Beca Doctorados en el Exterior Minciencias,2020
0001347185,"Distinción meritoria al trabajo final del plan de investigación de maestría en Ingeniería Agroindustrial: Determinación de las condiciones de extrusión de un material compuesto biodegradable a nivel industrial,Universidad Nacional de Colombia - Sede Palmira",2019
0001520249,"Mención de Honor a Trabajo de Grado,UNIVERSIDAD DEL CAUCA",2014
0001520249,"Mejor Bachiller Promoción 2009,Seminario Menor Arquidiocesano",2009
0001520249,"Matrícula de Honor. 2010-2014. ,UNIVERSIDAD DEL CAUCA",2014
0001520249,"Mérito académico,UNIVERSIDAD DEL CAUCA",2010
0001520249,"Mención a trabajo de investigación. Premio Larkin. IICTA 2016. ,UNIVERSIDAD NACIONAL DE COLOMBIA",2016
0001520249,Ganador de la categoría Innovaciones Superiores Ambientales. Premio CIDESCO a la Innovación 2020,2020
0001520249,"Top 500 - Premios Latinoamerica Verde,Premios Latinoamérica Verde",2021
0001520249,"Mayor citación en los últimos 5 años - Iniciación científica: conceptualización, metodologías y buenas prácticas,INSTITUCIÓN UNIVERSITARIA POLITÉCNICO GRANCOLOMBIANO",2021
0000270792,"Outstanding Oral Presentation. 19th Biennial Conference on Grain Sorghum Research and Utilization,National Association of Grain Sorghum Producers. Lubbock, Texas, USA",1995
0000270792,"Mejor Bachiller,Colegio República de Israel. Cali",1975
0000270792,"Becas Semestrales al Primer Puesto Académico,U. Valle",1978
