idcvlac,nombre,fecha
0000002712,"Becario V Convocatoria de COLCIENCIAS,Ministerio de Ciencia, Tecnología e Innovación",1996
0000002712,"Reconocimiento por la Fundación del Colegio de Promoción Social de Juventudes de Cristo Obrero en ipiales (Nariño),GOBERNACION DEL DEPARTAMENTO DE NARIÑO",1991
0000002712,"Tesis de Magister Meritoria,UNIVERSIDAD DEL VALLE",1992
0000002712,"Tesis de Doctorado Laureada,UNIVERSIDAD DEL VALLE",2000
0000002712,"Tesis de Pregrado Meritoria,UNIVERSIDAD DEL CAUCA",2015
0000002712,"Tesis de Pregrado Laureada,UNIVERSIDAD DEL CAUCA",2014
0000002712,"Tesis de pregrado meritoria ,UNIVERSIDAD DEL CAUCA",2020
0000916480,"Mejor Estudiante de la Facultad de Ciencias Exactas Naturales y de la Educación,UNIVERSIDAD DEL CAUCA",2004
0000916480,"Mejor Estudiante de la Facultad de Ciencias Exactas Naturales y de la Educación,UNIVERSIDAD DEL CAUCA",2006
0000916480,"Becaria del Programa de Becas de Verano del Laboratorio Nacional de Luz Sincrotron, Campinas, SP, Brasil,Laboratorio Nacional de Luz Sincrotron, Campinas, SP, Brasil",2006
0000916480,"Medalla ""Sergio Arboleda"",UNIVERSIDAD DEL CAUCA",2008
0000916480,"Beca JAE (Junta de amplación de estudios) para la realización de doctorado,CONSEJO SUPERIOR DE INVESTIGACIONES CIENTÍFICAS CSIC",2008
0000916480,"Premio al mejor póster,ASOCIACION DE USUARIOS DE SINCROTRON DE ESPAÑA",2011
0000773735,"Matrícula de honor,UNIVERSIDAD DEL CAUCA",2002
0000975877,"Matricula de honor,UNIVERSIDAD DEL CAUCA",2006
0000975877,"Tesis Laureada,UNIVERSIDAD DEL CAUCA",2008
0000975877,"Mencion Honorifica,UNIVERSIDAD DEL CAUCA",2011
0000419184,"Segundo Puesto - Quinta Olimpiada de Robótica GRIAL,UNIVERSIDAD PONTIFICIA BOLIVARIANA",2003
0000419184,"Tercer Puesto en la Primera Olimpiada de Robótica ATI,UNIVERSIDAD DEL CAUCA",2003
0000419184,"Primer Puesto en la Primera Olimpiada Nacional de Robótica con el robot autónomo Escorpio. ECIBOT,ESCUELA COLOMBIANA DE INGENIERIA JULIO GARAVITO",2004
0000419184,"Segundo Puesto Primera Olimpiada Nacional de Robótica con el robot autónomo Tarcobot. ECIBOT,ESCUELA COLOMBIANA DE INGENIERIA JULIO GARAVITO",2004
0000419184,"Primer puesto en el concurso de Robotica movil ROBORODENTIA con el robot SCORPIO,Polytechnic State University California",2005
0000419184,"Tercer puesto  en la VIII Olimpiada de Robotica A+D  en la categoria sumo autonomo con el robot SENSHUKEN,UNIVERSIDAD PONTIFICIA BOLIVARIANA",2006
0000419184,"Primer puesto en el Torneo Ciudad Robotica en la categoria sumo autonomo 3Kg con el robot K3TENEBRIUS,Asociación Colombiana de Robótica",2007
0000251224,"Mejor Mural presentado en el XX Congreso Nacional de Física,UNIVERSIDAD DEL QUINDÍO",2003
0000251224,"Primer Puesto en la VI Escuela Nacional de Física de Materia Condensada,UNIVERSIDAD DE ANTIOQUIA",2004
0000251224,"Tesis de Doctorado Laureada,UNIVERSIDAD DEL VALLE",2006
0000251224,"Beca Colciencias,Ministerio de Ciencia, Tecnología e Innovación",2003
0000251224,"Ganadora Tercer Lugar Trabajo de Investigación Presentado en el X ENO y Primera Conferencia Andina y del Caribe en Óptica y sus Aplicaciones,UNIVERSIDAD DEL VALLE",2006
0000251224,"Calificación Global Excelente 2008,PONTIFICIA UNIVERSIDAD JAVERIANA - PUJ - SEDE CALI",2009
0000251224,"Primero puesto X Premio nacional al Inventor Colombiano 2020 - Modalidad Investigación,Organización Mundial de la Propiedad Intelectual OMPI",2021
0000168829,"Mención Honorifica,UNIVERSIDAD DEL CAUCA",2016
0001516273,"Tesis Laureada,UNIVERSIDAD DEL CAUCA",2014
0001516273,"Micrografía Ganadora en el Concurso Internacional de Micrografía científica,Revista Nano Ciencia y Tecnología",2014
0001542327,"Exoneración Matricula Maestría por Buen rendimiento,UNIVERSIDAD DEL CAUCA",2014
0001542327,"Exoneración Matricula Maestría por Buen rendimiento,UNIVERSIDAD DEL CAUCA",2015
0001542327,"Exoneración Matricula Maestría por Buen rendimiento,UNIVERSIDAD DEL CAUCA",2015
0001476153,"Tesis Laureada-Estudio de fundentes alternativos para la elaboración de gres porcelánico,UNIVERSIDAD DEL VALLE",2013
0001476153,"Estimulo Académico,2013,UNIVERSIDAD DEL VALLE",2013
0001016520,"Matricula de Honor,UNIVERSIDAD DEL CAUCA",2004
0001016520,"Matricula de Honor,UNIVERSIDAD DEL CAUCA",2006
0000378631,"Mención Honorífica,UNIVERSIDAD DEL CAUCA",2003
0000378631,"Felicitación,UNIVERSIDAD DEL CAUCA",2020
0000036919,"Beca de Colciencias,Ministerio de Ciencia, Tecnología e Innovación",1995
0000036919,"Tesis Meritoria,UNIVERSIDAD DEL VALLE",2006
0001494646,"LACCIR Short Stays Program Awards 2010,The Latin American and Caribbean Collaborative ICT Research,Pontificia Universidad De Chile",2010
0001494646,"Ganador Beca 02A - 2015 Doctorados Nacionales,Red de formación de talento humano para la innovación social y productiva en el departamento del Cauca - InovAcción Cauca,UNIVERSIDAD DEL CAUCA",2015
0001494646,"Mejor proyecto de doctorado - Simposio de maestría y doctorado  ,Sociedad Colombiana de Computación",2017
0001368173,"Coordinador de la Red Colombiana de Semilelros de Investigación Nodo Cauca,Fundacion Red Colombiana de Semilleros de Investigacion RedColsi -  Nodo Bucaramanga",2016
0001368173,"Delegado Institucional Mesa Sur pacífico de Investigación ,Asociación Colombiana De Instituciones De Educación Superior con formación Técnica Profesional, Tecnológica o Universitaria",2020
0001535173,"GANADORES DEL CONCURSO A CIENCIA CIERTA POR EL PROYECTO ""SISTEMA DE INFORMACIÓN PARA EL ACUEDUCTO SAN ROQUE"",Ministerio de Ciencia, Tecnología e Innovación",2013
0001535173,"Egresado Destacado 2016- Programa Ingeniería de Sistemas ,CORPORACIÓN  UNIVERSITARIA COMFACAUCA - UNICOMFACAUCA",2016
0000074802,"PLACA Y CERTIFICACION POR OCUPAR EL PRIMER PUESTO DURANTE LA PONENCIA NACIONAL E INTERNACIONAL, SOBRE EL TRABAJO: SITIO WEB Y ACTUALIZACION SISTEMA DE INFORMACION PARA LA APICOLA EL VENTANAL DE TUNIA-PIENDAMO-CAUCA-COLOMBIA,ESCUELA DE POLICÍA SIMÓN BOLÍVAR DE TULUÁ",2016
0000894796,"Premio nacional  mejor investigación biología vegetal 52 congreso ACCB,Asociación Colombiana De Ciencias Biológicas - A.C.C.B",2017
0000894796,"Distincion Unicomfacauca egresado destacado en investigaciones 2017,CORPORACIÓN  UNIVERSITARIA COMFACAUCA - UNICOMFACAUCA",2017
0000894796,"Distincion Docente Investigador Unicomfacauca,CORPORACIÓN  UNIVERSITARIA COMFACAUCA - UNICOMFACAUCA",2017
0001361780,"Edición Especial,Redie",2012
0001361780,"OEA un estudio comparativo del aprendizaje de los estudiantes de  programa de ingenierias de sistemas utilizando ambientes virtuales Blearning con el modelo pedagógico traficional ,UNIVERSIDAD SANTIAGO DE CALI",2013
0001361780,"Jornada de fortalecimiento de las competencias de los pares academicos de la educación superior,Ministerio De Educación Nacional - Mineducación",2013
0001361780,"Curso de actualización en la docencia ,UNIVERSIDAD SANTIAGO DE CALI",2013
0001361780,"Cualificación en competencias clave para el ejercicio docente en Tic,UNIVERSIDAD SANTIAGO DE CALI",2013
0001361780,"Realización y Gestión de la Especialización en Tecnologías de la Información y la Comunicación en Educacion,CORPORACIÓN  UNIVERSITARIA COMFACAUCA - UNICOMFACAUCA",2015
0001361780,"REDACCIÓN Y ESTRUCTURACIÓN DEL DOCUMENTO DE LA ESPECIALIZACIÓN EN EDUMATICA,CORPORACIÓN UNIVERSITARIA AUTÓNOMA DEL CAUCA",2014
0001361780,"Expositora del Proyecto Parque Ecotematico FUP, en la Sexta semana Social FUP 2012,FUNDACION UNIVERSITARIA DE POPAYAN",2012
0001361780,"Estructuración de Libro Metricas de Aprendizaje en Seguridad Informatica,Universidad Mayor",2018
0001361780,"Investigador Junior - Colciencias,FUNDACION UNIVERSITARIA DE POPAYAN",2018
0001361780,"Par Evaluador de Proyectos de Investigación - Universidad Tecnologica de Pereira,UNIVERSIDAD TECNOLÓGICA DE PEREIRA",2019
0001361780,"La Universidad de Guadalajara a traves del Centro Universitario del Norte, hace constar la realizacion del diseño del Plan Curricular, Diseño Instruccional, Desarrollo Tecnologico, haciendo uso de la plataforma de aprendizaje Moodle y la Implementacion de,CORPORACIÓN  UNIVERSITARIA COMFACAUCA - UNICOMFACAUCA",2020
0001361780,"La Universidad de Guadalajara a traves del Centro Universitario del Norte, hace constar el desarrollo del Modulo I: ""Entornos virtuales de Enseñanza (EVEA), del Diplomado en innovacion de procesos de Gestión Educativa por medio del Uso de TIC, establecido,CORPORACIÓN  UNIVERSITARIA COMFACAUCA - UNICOMFACAUCA",2020
0001361780,"Desempeño y compromiso, contribuyendo al cumplimiento oportuno y eficaz de los objetivos institucionales, demostrando liderazgo y capacidad de ejecución.,ESCUELA MILITAR DE AVIACIÓN MARCO FIDEL SUAREZ EMAVI",2021
0000333816,"Mejor Docente,CORPORACIÓN  UNIVERSITARIA COMFACAUCA - UNICOMFACAUCA",2014
0001674493,"Certificado de Reconocimiento ,Universidad Nacional Pedro Ruiz Gallo",2016
0001674493,"Egresado destacado,CORPORACIÓN  UNIVERSITARIA COMFACAUCA - UNICOMFACAUCA",2019
0001462299,"Premio Planeta azul 2017,Banco de Occidente",2017
0001353314,"Resolución por 4° Puesto en la 3° Maratón de Desarrollo de Aplicaciones Móviles Comcel, Nokia  ,UNIVERSIDAD DEL CAUCA",2006
0001353314,"Resolución 2° Puesto en la Maratón de Desarrollo de Aplicaciones Móviles Comcel, Nokia ,UNIVERSIDAD DEL CAUCA",2007
0001353314,"Nominación a Mejor Artículo en Congreso Internacional CLIHC 2011: ""Diseñando Interfaces Gráficas Usables de Aplicaciones en Entornos de TDi""",2011
0001353314,"Mención de Honor proyecto de grado,Institución Universitaria Colegio Mayor del Cauca",2016
0001387326,"Por su desempeño destacado en la investigación y desarrollo,PROYECTAMOS: CONSULTORÍAS Y SERVICIOS INTEGRALES SAS",2021
0001365599,"Matricula de Honor,UNIVERSIDAD DEL CAUCA",2003
0001365599,"Media Matricula de Honor,UNIVERSIDAD DEL CAUCA",2004
0001365599,"Finalista Tercera Maratón de Desarrolladores,Centro De Investigación De Las Telecomunicaciones - Cintel",2006
0001365599,"Segundo Puesto en la IV Maratón de desarrolladores,Centro De Investigación De Las Telecomunicaciones - Cintel",2007
0001365599,pHealth 2014 - Young Scientist Best Paper Award,2014
0000523496,"Reconocimiento como Evaluador de la Revista de investigaciones I+D+i edición 2018,CORPORACIÓN  UNIVERSITARIA COMFACAUCA - UNICOMFACAUCA",2018
0000523496,"Ganador Concurso de Tesis de Maestría,Centro Latinoamericano de Estudios en Informática",2020
0000523496,"Ganador mejor ponencia en Capítulo de Interacción Humano-Computador del Simposio SCO2,Sociedad Colombiana de Computación",2020
0001499924,"Beca meritos al mejor estudiante,Colegio Mayor Del Cauca - Institución Universitaria",2002
0001499924,"primer puesto Maraton de programación,Colegio Mayor Del Cauca - Institución Universitaria",2001
0001499924,"Reconocimiento Jonas RunDQuist a la Innovación, por el proyecto Conformación de Núcleos de Innovación Fundamentados en la Gestión del Conocimiento de productos Innovadores en el Cauca.,Proyecto núcleos de innovación",2015
0001499924,"Egresado distinguido por actividad empresarial,Colegio Mayor Del Cauca - Institución Universitaria",2016
0000374865,"Emprendimiento Libre 2003,Red de parques tecnologicos del software",2003
0000374920,"Mension de Honor - Tesis del pregrado,UNIVERSIDAD DEL CAUCA",1984
0000212440,"Mejor Proyecto Innovador,UCICA",2002
0000212440,"Mejor Proyecto en el Sector Agropecuario (Sistema Agropecuario Integral Inteligente),UNIVERSIDAD DEL CAUCA",2003
0000212440,"2 Puesto en el 1er Congreso Nacional de Economía Solidaria,Universidad Javeriana y DANSOCIAL",2004
0000170944,"Proyecto sobresaliente XII Encuentro Departamental de Semilleros de Investigación (EDESI2018),Fundacion Red Colombiana de Semilleros de Investigacion RedColsi -  Nodo Bucaramanga",2018
0001412477,"Media Matrícula de Honor,UNIVERSIDAD DEL CAUCA",2007
0001412477,"Tesis Laureada,UNIVERSIDAD DEL CAUCA",2013
0001412477,"Primer puesto en la décima Convocatoria de Apoyo a proyectos de Investigación, Desarrollo e Innovación en el  marco de Maestrías, Doctorados y Especialidades Médico Quirúrgicas. Resolución N° 01 de 2017,UNIVERSIDAD DEL CAUCA",2017
0001412477,"Beca de Movilidad Académica entre Universidades Andaluzas e Iberoamericanas asociadas a la AUIP,Asociación Universitaria  Iberoamericana de Postgrado",2017
0001412477,"Primer puesto en la V Convocatoria de Prototipado - Unicomfacauca,CORPORACIÓN  UNIVERSITARIA COMFACAUCA - UNICOMFACAUCA",2020
0001412477,"Tesis meritoria,CORPORACIÓN  UNIVERSITARIA COMFACAUCA - UNICOMFACAUCA",2021
0001698898,"Reconocimiento Proyecto Sobresaliente,Fundacion Red Colombiana de Semilleros de Investigacion RedColsi -  Nodo Bucaramanga",2019
0001492988,"Merito a la Innovación Educativa,Colegio Mayor Del Cauca - Institución Universitaria",2018
0001492988,"Mención de Honor,Colegio Mayor Del Cauca - Institución Universitaria",2019
0001492988,"Trabajo de grado Laureado,Colegio Mayor Del Cauca - Institución Universitaria",2020
0001492988,"Mención Como trabajo Laureado,Colegio Mayor Del Cauca - Institución Universitaria",2022
0001492988,"Mención de Honor,Colegio Mayor Del Cauca - Institución Universitaria",2022
0000438456,"Premio Departamental de Periodismo Francisco Lemos Arboleda,Departamento del Cauca",1997
0000438456,"Premio Departamental de Periodismo Francisco Lemos Arboleda-Modalidad Trabajo Ecológico,Departamento del Cauca",1997
0000438456,"Beca para realizar estudios de doctorado,Comisión Fullbright",2007
0000438456,Beca de la Agencia Española de Cooperación Internacional en curso de especialización intensiva en producción de documentales,1998
0000900893,"Mención de Honor Munoz- B,Colegio Mayor Del Cauca - Institución Universitaria",2015
0000900893,"Mencion de Honor 2021,Colegio Mayor Del Cauca - Institución Universitaria",2021
0000900893,"Mencion de Honor Melo_Correa,Colegio Mayor Del Cauca - Institución Universitaria",2017
0000900893,"Mejor Poster ,UNIVERSIDAD DEL CAUCA",2018
0000900893,"Excelencia Labor Docente,Colegio Mayor Del Cauca - Institución Universitaria",2019
0001727629,"Construcción de un índice de vegetación mejorado para la detección de deforestación en el Amazonas basado en programación genética,CORPORACIÓN  UNIVERSITARIA COMFACAUCA - UNICOMFACAUCA",2019
0001727629,"Ganador Primer Lugar Quinta Convocatoria de Prototipado 2020,CORPORACIÓN  UNIVERSITARIA COMFACAUCA - UNICOMFACAUCA",2020
0001727629,"Producción de investigación,CORPORACIÓN  UNIVERSITARIA COMFACAUCA - UNICOMFACAUCA",2020
0001620320,"Joven Investigador - Colciencias,Ministerio de Ciencia, Tecnología e Innovación",2014
0001620320,"Ganador I Convocatoria de BECAS INTERNACIONALES DE EXCELENCIA ALIANZA DEL PACÍFICO.,Universidad De Extremadura",2014
0001620320,"Ganador Programa de Movilidad Académica entre Universidades Andaluzas e Iberoamericanas asociadas a la AUIP,Asociación Universitaria  Iberoamericana de Postgrado",2015
0001620320,"Beneficiaria Convocatoria de Doctorados Nacionales 2017 - # 785,Ministerio de Ciencia, Tecnología e Innovación",2018
0001620320,"Premio al mejor trabajo de Simposio Doctoral en el 14 Congreso Colombiano de Computacion,Universidad Cesmag",2019
0001620320,"Proyecto destacado en el área de datos, información y conocimiento,Sociedad Colombiana de Computación",2020
0001620320,"Reconocimiento por producción de investigación ,CORPORACIÓN  UNIVERSITARIA COMFACAUCA - UNICOMFACAUCA",2020
0000001761,"Mención Andres Bello,Instituto Colombiano para la Evaluación de la Educación",2002
0000001761,"Medalla Universidad del Cauca,UNIVERSIDAD DEL CAUCA",2008
0001348276,"Estimulo,UNIVERSIDAD DEL VALLE",2010
0001348276,"Estimulo,UNIVERSIDAD DEL VALLE",2011
0000002006,"Matricula de Honor,UNIVERSIDAD DEL CAUCA",2005
0000002006,"Matricula de Honor,UNIVERSIDAD DEL CAUCA",2006
0000002006,"Matricular de Honor,UNIVERSIDAD DEL CAUCA",2007
0000002006,"Matricula de Honor,UNIVERSIDAD DEL CAUCA",2008
0000002006,"Matricula de Honor,UNIVERSIDAD DEL CAUCA",2009
0000002006,"Matricula de Honor,UNIVERSIDAD DEL CAUCA",2010
0000063743,"Nota especial en CURSO ESPECIAL EN PEDAGOGÍA BÁSICA PARA ORIENTAR LA FORMACIÓN PROFESIONAL INTEGRAL,Servicio Nacional De Aprendizaje Sede Popayan",2014
0000000404,"Mención tesis de pregrado en Historia: Lauredo,UNIVERSIDAD DEL VALLE",2012
0000000404,"Ganadora de la Convocatoria Nacional para el Programa Jóvenes Investigadores e Innovadores año 2012,Ministerio de Ciencia, Tecnología e Innovación",2013
0000000404,"Elegida como beneficiaria del programa de Asistente de Docencia de la Maestría en Historia de la Universidad del Valle,UNIVERSIDAD DEL VALLE",2014
0000000404,"Becaria en la Convocatoria de Becas CONACYT en el Colegio de México,EL COLEGIO DE MEXICO",2015
0000000404,"Seleccionada en la convocatoria del Programa de Becas de Integración Regional para ciudadanos de Latinoamérica y el Caribe que otorga el Ministerio de Educación, Cultura, Ciencia y Tecnología de la República Argentina, Ministerio de EducaciÃ³n, Cultura, Ciencia y TecnologÃ­a",2018
0001351820,"Premio Cuadernos Coloniales II 2019 ,Instituto Colombiano De Antropología E Historia - Icanh",2019
0000709786,"Tesis Honorifica,FUNDACION UNIVERSITARIA DE POPAYAN",2016
0000709786,"Investigador Destacado-Investigador Junior,FUNDACION UNIVERSITARIA DE POPAYAN",2018
0000709786,"proyecto de Investigación,FUNDACION UNIVERSITARIA DE POPAYAN",2018
0000709786,"Reconocimiento a Semillero Investigación,FUNDACION UNIVERSITARIA DE POPAYAN",2019
0000709786,"Mención al mejor trabajo de Industria,FUNDACION UNIVERSITARIA DE POPAYAN",2021
0000724971,"Beca B+ para la asistencia a la V Escuela Nanoandes,Cooperación Francesa para América del Sur",2015
0000724971,"Beca completa para la asistencia a la Escuela de invierno J. J. Giambiagi - Físicos en el mundo de la salud: un encuentro transdisciplinario,CELFI - CENTRO LATINOAMERICANO DE FORMACIÓN INTERDISCIPLINARIA",2018
0000724971,"Beca completa para la asistencia a la Escuela de verano 2019 ¿ Programa de doctorado en ciencias biomédicas,UNIVERSIDAD DE CHILE",2019
0000724971,"Beca completa para la asistencia a 1st São Carlos Advanced School on Materials Science & Engineering (SanCAS-MSE),Universidade Federal de São Carlos",2012
0000173229,"DIPLOMA DE EXCELENCIA DOCENTE ,FUNDACION UNIVERSITARIA DE POPAYAN",2019
0000173229,"Por su destacada labor docente PROGRAMA DE INGENIERÍA INDUSTRIAL,FUNDACION UNIVERSITARIA DE POPAYAN",2019
0000173229,"POR SU APORTE EN LAS ESTRATEGIAS DE FORTALECIMIENTO DE LA IMAGEN COORPORATIVA DEL HOSPITAL FRANCISCO DE PAULA SANTANDER E.S.E.,HOSPITAL FRANCISCO DE PAULA SANTANDER",2013
0000173229,"Docencia de Excelencia,FUNDACION UNIVERSITARIA DE POPAYAN",2021
0000521965,"Docente investigador,FUNDACION UNIVERSITARIA DE POPAYAN",2018
0000521965,"Investigador,FUNDACION UNIVERSITARIA DE POPAYAN",2018
0000521965,"Grado de Honor,FUNDACION UNIVERSITARIA DE POPAYAN",2019
0000521965,"Investigador Junior,FUNDACION UNIVERSITARIA DE POPAYAN",2019
0000032920,"II Jornada de Divulgación de Resultados de Semilleros de Investigación,FUNDACION UNIVERSITARIA DE POPAYAN",2018
0000032920,"Evaluador en el III Encuentro Institucional de Semilleros de Investigación,FUNDACION UNIVERSITARIA DE POPAYAN",2019
0000032920,"Grado de Honor,FUNDACION UNIVERSITARIA DE POPAYAN",2019
0001649662,"Mención Honorífica al trabajo de grado titulado ""Evaluación mediante herramientas tecnológicas de la habilidad motriz fina de  miembro superior: caso de estudio"",UNIVERSIDAD DEL CAUCA",2017
0001624639,"Mención de Honor,FUNDACION UNIVERSITARIA DE POPAYAN",2019
0001760200,"EGRESADO DESTACADO,FUNDACION UNIVERSITARIA DE POPAYAN",2021
0000129494,"II Jornada Interna de socialización de proyectos de investigación,FUNDACION UNIVERSITARIA DE POPAYAN",2018
0000129494,"Mejor Valoración de trabajo - Conferencia Internacional de Ingeniería Inngenio 2018,Corporación Instituto Antioqueño de Investigación",2018
0000129494,"Joven Investigadora,FUNDACION UNIVERSITARIA DE POPAYAN",2018
0000129494,"Semestre de Industria Destacado,FUNDACION UNIVERSITARIA DE POPAYAN",2018
0000129494,"Semestre de Industria Destacado: 2019,FUNDACION UNIVERSITARIA DE POPAYAN",2019
0000129494,"III Encuentro Institucional de Semilleros de Investigación,FUNDACION UNIVERSITARIA DE POPAYAN",2019
0000129494,"Orden al mérito investigativo,FUNDACION UNIVERSITARIA DE POPAYAN",2022
0000129494,"Primer puesto VI Encuentro de Semilleros de Investigación Sinergia y Creatividad,UNIVERSIDAD MANUELA BELTRAN",2022
0000411884,"Docente Investigador,FUNDACION UNIVERSITARIA DE POPAYAN",2018
0000411884,"ACUAPONIA DIGITAL PARA TODOS,UNIVERSIDAD DE LOS ANDES",2020
0000411884,"INVESTIGADOR ASOCIADO MINCIENCIAS,Ministerio de Ciencia, Tecnología e Innovación - Minciencias",2022
0000411884,"MEJOR DOCENTE INVESTIGADOR,FUNDACION UNIVERSITARIA DE POPAYAN",2022
0000411884,"ORDEN DE MERITO INVESTIGATIVO,FUNDACION UNIVERSITARIA DE POPAYAN",2022
0000267244,"Premio Nacional de la Ganaderia,Federación De Ganaderos De Colombia - Fedegan",2009
0000267244,"Investigador Destacado,UNIVERSIDAD DEL CAUCA",2015
0000267244,Reconocimiento por invaluable aporte al fortalecimiento organizativo,2017
0000267244,Trayectoria investigativa,2018
0000267244,participación y aporte como padrino tecnológico,2018
0000267244,Mención Meritoria,2019
0000267244,"Mencion meritoria,UNIVERSIDAD DEL CAUCA",2021
0000267244,"Mencion meritoria año 2018,UNIVERSIDAD DEL CAUCA",2018
0000347485,"Primer lugar con el poster ¿ Utilización de microorganismos eficientes (EM), como alternativa de manejo en efluentes porcícolasdel Departamento del Cauca¿ en la sesión de Taxonomía y Ecología de Organismos Acuáticos del 14 de noviembre de 2008,Asociación Colombiana De Limnología",2008
0000347485,"I Jornada Ambiental  - Facultad de Ciencias Agropecuarias,UNIVERSIDAD DEL CAUCA",2006
0000347485,Tesis Meritoria,2008
0000347485,"Exaltar la labor realizada por los directores de los proyectos del fondo de Ciencia Tecnología e Innovación, financiados por el Sistema General de Regalías para el Departamento del Cauca,UNIVERSIDAD DEL CAUCA",2015
0000347485,"Tesis Meritoria,UNIVERSIDAD DEL CAUCA",2019
0000720011,"Mejor Docente Facultad de Ingeniería programa de Ingeniería Informática,Colegio Mayor Del Cauca - Institución Universitaria",2016
0000720011,"Compromiso, responsabilidad y participación Activa en la Institución,Colegio Mayor Del Cauca - Institución Universitaria",2017
0000720011,"Beca Colciencias Doctorados Nacionales Convocatoria 785 de 2017,Colciencias",2017
0000720011,"Excelente Labor Docente en la Facultad de Ingenierías-Programa de Ingeniería informática,Institución Universitaria Colegio Mayor del Cauca",2018
0000720011,"Beca otorgada para la realización del curso en Dispositivos fotovoltaicos y optoelectrónicos. Diseño y desarrollo de tecnologías limpias y sustentables. Aplicación e impacto social,CENTRO LATINOAMERICANO DE FORMACIÓN INTERDISCIPLINARIA (CELFI)-SUSTENTABILIDAD Y DESARROLLO",2019
0001237675,"Beca por mejor promedio de notas en primer semestre de pregrado,UNIVERSIDAD DEL CAUCA",2001
0001237675,"Beca por excelencia academica en posgrado I semestre,Universidad Nacional de Colombia - Sede Palmira",2008
0001237675,"Beca por excelencia academica en posgrado II semestre,Universidad Nacional de Colombia - Sede Palmira",2008
0001237675,"Beca por excelencia academica en posgrado III semestre,Universidad Nacional de Colombia - Sede Palmira",2009
0001237675,"Beca por excelencia academica en posgrado IV semestre,Universidad Nacional de Colombia - Sede Palmira",2009
0001370725,"Mensiòn de Honor por tesis,UNIVERSIDAD DEL CAUCA",2010
0001370725,"Reconocimiento por la loable labor desempeñada al frente de la institución  ,Corporación Autónoma Regional del Cauca",2014
0001370725,"Mejor promedio estudiante de posgrado,UNIVERSIDAD NACIONAL DE COLOMBIA",2014
0001370725,"Mejor promedio estudiante de posgrado,UNIVERSIDAD NACIONAL DE COLOMBIA",2015
0001370725,"Tesis meritoria,UNIVERSIDAD DEL CAUCA",2019
0001370725,"Mención de honor,UNIVERSIDAD DEL CAUCA",2018
0001370725,"Tesis aprobada mediante resolución N° 41 de abril 30 de 2020 por el Consejo de Facultad de Ciencias Agrarias,UNIVERSIDAD DEL CAUCA",2020
0001370725,"Trabajo de grado aprobado mediante resolución N° 285 de 2019 del Consejo de Facultad de Ciencias Agrarias,UNIVERSIDAD DEL CAUCA",2019
0001370725,"Trabajo de grado aprobado mediante resolución N° 202 de 2019 del Consejo de Facultad de Ciencias Agrarias. ,UNIVERSIDAD DEL CAUCA",2019
0001370725,"Mención de honor ,UNIVERSIDAD DEL CAUCA",2019
0001370725,"Trabajo de grado aprobado mediante resolución N° 17 de 2020 por el Consejo de Facultad de Ciencias Agrarias,UNIVERSIDAD DEL CAUCA",2020
0001370725,"Trabajo de grado aprobado mediante resolución N° 165 de 2020 por el Consejo de Facultad de Ciencias Agrarias,UNIVERSIDAD DEL CAUCA",2020
0001370725,"Trabajo de grado aprobado mediante resolución N° 157 de 2020 por el Consejo de Facultad de Ciencias Agrarias,UNIVERSIDAD DEL CAUCA",2020
0001370725,"Trabajo de grado aprobado mediante resolución N° 2 de 2021 por el Consejo de Facultad de Ciencias Agrarias,UNIVERSIDAD DEL CAUCA",2021
0001370725,"Trabajo de grado aprobado mediante resolución N° 164 de 2020 por el Consejo de Facultad de Ciencias Agrarias,UNIVERSIDAD DEL CAUCA",2020
0001370725,"Trabajo de grado aprobado mediante resolución N° 6 de 2021 por el Consejo de Facultad de Ciencias Agrarias,UNIVERSIDAD DEL CAUCA",2021
0001370725,"Tesis meritoria,Universidad Autónoma de Tamaulipas",2020
